{
  "id": "BELIEF_ETHICS",
  "relation": "TRUTH",
  "territory": "BELIEF_KNOWLEDGE",
  "label": {
    "fr": "Éthique de la croyance",
    "en": "Ethics of belief"
  },
  "question": {
    "fr": "Peut-on légitimement croire sans preuves suffisantes ?",
    "en": "Can we legitimately believe without sufficient evidence?"
  },
  "stakes": {
    "fr": "Croire engage : l'armateur qui s'est persuadé sans preuve que son navire tiendrait la mer répond du naufrage, car il n'avait pas le droit de le croire. Faut-il alors proportionner toute croyance aux preuves, ou existe-t-il des cas, l'amitié, l'engagement, la foi, où se refuser à croire faute de garantie serait aussi une faute ? Se positionner, c'est dire ce que nous devons à la preuve quand nous formons nos croyances, et de quoi nous sommes comptables en les tenant.",
    "en": "To believe commits us: the shipowner who talked himself into trusting, without proof, that his vessel would hold answers for the wreck, for he had no right to believe it. Must we then proportion every belief to the evidence, or are there cases, friendship, commitment, faith, where refusing to believe for want of a guarantee would itself be a fault? To take a position is to say what we owe to evidence when we form our beliefs, and what we are accountable for in holding them."
  },
  "layer": "VALUE",
  "type": "BIPOLAR",
  "poles": [
    {
      "id": "EVIDENTIALISM",
      "label": {
        "fr": "Évidentialisme",
        "en": "Evidentialism"
      },
      "description": {
        "fr": "Il est toujours fautif, pour quiconque, de croire quoi que ce soit sur la base de preuves insuffisantes. Croire à la légère n'est pas seulement une erreur intellectuelle, c'est un manquement moral qui affaiblit la confiance commune.",
        "en": "It is wrong, always and for anyone, to believe anything on insufficient evidence. Believing carelessly is not merely an intellectual mistake but a moral failing that erodes our shared trust."
      },
      "figures": [
        {
          "slug": "clifford",
          "name": {
            "fr": "Clifford",
            "en": "Clifford"
          }
        }
      ]
    },
    {
      "id": "DOXASTIC_VOLUNTARISM",
      "label": {
        "fr": "Non-évidentialisme",
        "en": "Non-evidentialism"
      },
      "description": {
        "fr": "Quand les preuves ne tranchent pas et que l'enjeu est vital, nous avons le droit, parfois même le devoir, de croire au-delà de ce que l'évidence garantit. Certaines vérités ne se révèlent qu'à celui qui ose d'abord parier sur elles.",
        "en": "When the evidence is inconclusive and the stakes are vital, we have the right, sometimes even the duty, to believe beyond what the evidence guarantees. Some truths reveal themselves only to those who first dare to wager on them."
      },
      "figures": [
        {
          "slug": "william-james",
          "name": {
            "fr": "W. James",
            "en": "W. James"
          }
        },
        {
          "slug": "pascal",
          "name": {
            "fr": "Pascal",
            "en": "Pascal"
          }
        }
      ]
    }
  ],
  "core": false,
  "difficulty": 2,
  "clusters": [],
  "relatedAxes": [
    "CERTAINTY",
    "FAITH_REASON",
    "GOD_EXISTENCE",
    "SOVEREIGN_GOOD",
    "EPISTEMIC_JUSTIFICATION",
    "TRUTH_VALUE"
  ]
}
